[
  {
    "timestamp": 0.08,
    "event": "person_appeared",
    "confidence": 0.869,
    "subject": {
      "team": "teammate",
      "agent": "sage",
      "track_id": 1
    }
  },
  {
    "timestamp": 0.76,
    "event": "person_appeared",
    "confidence": 0.795,
    "subject": {
      "team": "enemy",
      "agent": "reyna",
      "track_id": 2
    }
  },
  {
    "timestamp": 0.88,
    "event": "state_changed",
    "confidence": 1.0,
    "subject": {
      "type": "pov_player"
    },
    "details": {
      "field": "ammo",
      "from": 12,
      "to": 11
    }
  },
  {
    "timestamp": 1.0,
    "event": "state_changed",
    "confidence": 1.0,
    "subject": {
      "type": "pov_player"
    },
    "details": {
      "field": "ammo",
      "from": 11,
      "to": 10
    }
  },
  {
    "timestamp": 1.12,
    "event": "state_changed",
    "confidence": 1.0,
    "subject": {
      "type": "pov_player"
    },
    "details": {
      "field": "ammo",
      "from": 10,
      "to": 9
    }
  },
  {
    "timestamp": 1.32,
    "event": "state_changed",
    "confidence": 0.983,
    "subject": {
      "type": "pov_player"
    },
    "details": {
      "field": "ammo",
      "from": 9,
      "to": 8
    }
  },
  {
    "timestamp": 1.4,
    "event": "person_disappeared",
    "confidence": 0.992,
    "subject": {
      "team": "teammate",
      "agent": "sage"
    },
    "details": {
      "reason": "death",
      "killer": "waylay",
      "weapon": "Ghost"
    }
  },
  {
    "timestamp": 1.4,
    "event": "state_changed",
    "confidence": 0.978,
    "subject": {
      "type": "spike"
    },
    "details": {
      "status": "dropped",
      "reason": "carrier_killed"
    }
  },
  {
    "timestamp": 1.56,
    "event": "state_changed",
    "confidence": 0.999,
    "subject": {
      "type": "pov_player"
    },
    "details": {
      "field": "ammo",
      "from": 8,
      "to": 7
    }
  },
  {
    "timestamp": 1.68,
    "event": "state_changed",
    "confidence": 1.0,
    "subject": {
      "type": "pov_player"
    },
    "details": {
      "field": "ammo",
      "from": 7,
      "to": 6
    }
  },
  {
    "timestamp": 1.88,
    "event": "state_changed",
    "confidence": 1.0,
    "subject": {
      "type": "pov_player"
    },
    "details": {
      "field": "ammo",
      "from": 6,
      "to": 5
    }
  },
  {
    "timestamp": 1.92,
    "event": "state_changed",
    "confidence": 1.0,
    "subject": {
      "type": "pov_player"
    },
    "details": {
      "field": "health",
      "from": 100,
      "to": 91
    }
  },
  {
    "timestamp": 2.0,
    "event": "state_changed",
    "confidence": 1.0,
    "subject": {
      "type": "pov_player"
    },
    "details": {
      "field": "ammo",
      "from": 5,
      "to": 4
    }
  },
  {
    "timestamp": 2.2,
    "event": "state_changed",
    "confidence": 1.0,
    "subject": {
      "type": "pov_player"
    },
    "details": {
      "field": "ammo",
      "from": 4,
      "to": 3
    }
  },
  {
    "timestamp": 2.4,
    "event": "state_changed",
    "confidence": 1.0,
    "subject": {
      "type": "pov_player"
    },
    "details": {
      "field": "ammo",
      "from": 3,
      "to": 2
    }
  },
  {
    "timestamp": 2.4,
    "event": "state_changed",
    "confidence": 1.0,
    "subject": {
      "type": "pov_player"
    },
    "details": {
      "field": "health",
      "from": 91,
      "to": 65
    }
  },
  {
    "timestamp": 2.52,
    "event": "state_changed",
    "confidence": 1.0,
    "subject": {
      "type": "pov_player"
    },
    "details": {
      "field": "ammo",
      "from": 2,
      "to": 1
    }
  },
  {
    "timestamp": 2.6,
    "event": "state_changed",
    "confidence": 1.0,
    "subject": {
      "type": "pov_player"
    },
    "details": {
      "field": "health",
      "from": 65,
      "to": 35
    }
  },
  {
    "timestamp": 2.68,
    "event": "state_changed",
    "confidence": 1.0,
    "subject": {
      "type": "pov_player"
    },
    "details": {
      "field": "ammo",
      "from": 1,
      "to": 0
    }
  },
  {
    "timestamp": 2.8,
    "event": "person_disappeared",
    "confidence": 0.994,
    "subject": {
      "team": "enemy",
      "agent": "waylay"
    },
    "details": {
      "reason": "death",
      "killer": "brimstone",
      "weapon": "Classic"
    }
  },
  {
    "timestamp": 3.24,
    "event": "person_appeared",
    "confidence": 0.638,
    "subject": {
      "team": "enemy",
      "agent": null,
      "track_id": 3
    }
  },
  {
    "timestamp": 3.96,
    "event": "person_disappeared",
    "confidence": 0.795,
    "subject": {
      "team": "enemy",
      "agent": "reyna",
      "track_id": 2
    },
    "details": {
      "reason": "unknown"
    }
  },
  {
    "timestamp": 4.08,
    "event": "state_changed",
    "confidence": 1.0,
    "subject": {
      "type": "pov_player"
    },
    "details": {
      "field": "ammo",
      "from": 0,
      "to": 12
    }
  },
  {
    "timestamp": 4.28,
    "event": "person_appeared",
    "confidence": 0.795,
    "subject": {
      "team": "teammate",
      "agent": "reyna",
      "track_id": 4
    }
  },
  {
    "timestamp": 4.44,
    "event": "person_disappeared",
    "confidence": 0.638,
    "subject": {
      "team": "enemy",
      "agent": null,
      "track_id": 3
    },
    "details": {
      "reason": "unknown"
    }
  },
  {
    "timestamp": 5.16,
    "event": "object_detected",
    "confidence": 0.825,
    "subject": {
      "type": "smoke"
    }
  },
  {
    "timestamp": 5.6,
    "event": "person_disappeared",
    "confidence": 0.795,
    "subject": {
      "team": "teammate",
      "agent": "reyna",
      "track_id": 4
    },
    "details": {
      "reason": "unknown"
    }
  },
  {
    "timestamp": 5.6,
    "event": "state_changed",
    "confidence": 0.88,
    "subject": {
      "type": "spike"
    },
    "details": {
      "status": "planting"
    }
  },
  {
    "timestamp": 9.12,
    "event": "object_detected",
    "confidence": 0.715,
    "subject": {
      "type": "smoke"
    }
  },
  {
    "timestamp": 9.88,
    "event": "person_appeared",
    "confidence": 0.746,
    "subject": {
      "team": "teammate",
      "agent": null,
      "track_id": 5
    }
  },
  {
    "timestamp": 10.2,
    "event": "state_changed",
    "confidence": 0.815,
    "subject": {
      "type": "spike"
    },
    "details": {
      "status": "planted"
    }
  },
  {
    "timestamp": 11.2,
    "event": "person_disappeared",
    "confidence": 0.746,
    "subject": {
      "team": "teammate",
      "agent": null,
      "track_id": 5
    },
    "details": {
      "reason": "unknown"
    }
  },
  {
    "timestamp": 11.28,
    "event": "object_detected",
    "confidence": 0.512,
    "subject": {
      "type": "smoke"
    }
  },
  {
    "timestamp": 11.48,
    "event": "person_appeared",
    "confidence": 0.744,
    "subject": {
      "team": "teammate",
      "agent": "iso",
      "track_id": 6
    }
  },
  {
    "timestamp": 12.56,
    "event": "person_disappeared",
    "confidence": 0.744,
    "subject": {
      "team": "teammate",
      "agent": "iso",
      "track_id": 6
    },
    "details": {
      "reason": "unknown"
    }
  },
  {
    "timestamp": 13.68,
    "event": "person_appeared",
    "confidence": 0.602,
    "subject": {
      "team": "teammate",
      "agent": "raze",
      "track_id": 7
    }
  },
  {
    "timestamp": 13.8,
    "event": "person_disappeared",
    "confidence": 0.853,
    "subject": {
      "team": "teammate",
      "agent": "tejo"
    },
    "details": {
      "reason": "death",
      "killer": "yoru",
      "weapon": "Ghost"
    }
  },
  {
    "timestamp": 14.56,
    "event": "person_appeared",
    "confidence": 0.394,
    "subject": {
      "team": "teammate",
      "agent": "yoru",
      "track_id": 8
    }
  },
  {
    "timestamp": 14.64,
    "event": "object_detected",
    "confidence": 0.589,
    "subject": {
      "type": "cypher_tripwire_anchor"
    },
    "details": {
      "review": "false_positive"
    }
  },
  {
    "timestamp": 14.76,
    "event": "person_disappeared",
    "confidence": 0.602,
    "subject": {
      "team": "teammate",
      "agent": "raze",
      "track_id": 7
    },
    "details": {
      "reason": "unknown"
    }
  },
  {
    "timestamp": 14.8,
    "event": "person_disappeared",
    "confidence": 0.963,
    "subject": {
      "team": "enemy",
      "agent": null
    },
    "details": {
      "reason": "death",
      "killer": "yoru",
      "weapon": "Classic"
    }
  },
  {
    "timestamp": 15.76,
    "event": "person_appeared",
    "confidence": 0.687,
    "subject": {
      "team": "teammate",
      "agent": "yoru",
      "track_id": 9
    }
  },
  {
    "timestamp": 16.56,
    "event": "person_disappeared",
    "confidence": 0.394,
    "subject": {
      "team": "teammate",
      "agent": "yoru",
      "track_id": 8
    },
    "details": {
      "reason": "tracking_loss_suspected"
    }
  },
  {
    "timestamp": 17.76,
    "event": "person_disappeared",
    "confidence": 0.687,
    "subject": {
      "team": "teammate",
      "agent": "yoru",
      "track_id": 9
    },
    "details": {
      "reason": "unknown"
    }
  },
  {
    "timestamp": 20.0,
    "event": "state_changed",
    "confidence": 0.933,
    "subject": {
      "type": "spike"
    },
    "details": {
      "status": "planted"
    }
  },
  {
    "timestamp": 20.233,
    "event": "object_detected",
    "confidence": 0.749,
    "subject": {
      "type": "dropped_weapon"
    }
  },
  {
    "timestamp": 20.733,
    "event": "object_detected",
    "confidence": 0.329,
    "subject": {
      "type": "dropped_spike"
    },
    "details": {
      "review": "conflicting_state_unverified"
    }
  },
  {
    "timestamp": 22.533,
    "event": "person_appeared",
    "confidence": 0.708,
    "subject": {
      "team": "enemy",
      "agent": null,
      "track_id": 10
    }
  },
  {
    "timestamp": 22.6,
    "event": "person_disappeared",
    "confidence": 1.0,
    "subject": {